{
  "schema_version": "1.0",
  "request_id": "cdg00-parse-host-001",
  "trace_id": "trace-cdg00-parse-host-001",
  "acquisition_mode": "pushbroom",
  "sensor": {"id": "cdg00"},
  "input": {
    "artifact_ref": "artifact://raw/cdg00/20250404142111_A1_0.dat",
    "path": "/replace/with/20250404142111_A1_0.dat",
    "media_type": "application/x-cdg00",
    "size_bytes": 52822016,
    "sha256": "336a30600aacb1a747829c717d7f71abce8a24ff3744ae7698d2d91da3def01e"
  },
  "processing": {
    "runtime_profile": "msf.cdg00.parse-host.v1",
    "max_frames": 64
  }
}
